"prior_message","barney_message"
"What?!","You heard me."
"You want to sleep with Jenkins?","With Jenkins, of Jenkins, near Jenkins. You said it, I want to put like a sock."
"At the bar...","But huh?"
"But um, it would seem, she often said.","It's funny, I also had a drinking game based on Robin, Robin finally. At the bottom of her stomach..."
"It was agreed that you do not speak of those things.","Sorry, you're right. She did not like anyway. She said it woke her up. Does she said ""But um"" so often?"
"She thinks she is strong. That's right, I have to prove that I am not the weak. I will make her jealous.","Easy, that's the plan: A, layer with Jenkins. Two, I sleep with Jenkins first. Three, the second rule is the first I'm going to rule 2."
"She throws herself on her and continues to type.","Marshall, you're in the field!"
